{
  "id": "exp1b-ambient-nobrowse-1020",
  "protocol_version": "1.4",
  "meta": {
    "model": "gpt-5.1",
    "provider": "openai",
    "condition": "user_only_vpp_ambient_nobrowse",
    "challenge_type": "user_only_protocol",
    "created_at": "2026-06-01T04:56:21.424Z",
    "task_template_id": "exp1b-user-only",
    "injection_template_id": null,
    "seed": 2010
  },
  "label": "bad",
  "failure_modes": [
    "missing_header",
    "missing_footer",
    "tag_mismatch"
  ],
  "turns": [
    {
      "turn_index": 0,
      "role": "user",
      "raw_header": "!<q>",
      "tag": "q",
      "modifiers": [],
      "body": "test",
      "footer": null,
      "parsed_footer": null
    },
    {
      "turn_index": 1,
      "role": "assistant",
      "raw_header": "It looks like you sent `!<q>` followed by `test`.",
      "tag": null,
      "modifiers": [],
      "body": "If you’re testing how I respond to a particular format or command, let me know what behavior you expect from `!<q>` (e.g., quoting, special parsing, etc.), and I can adapt my responses accordingly.\n\nFor now, here’s a simple echo of your content:",
      "footer": "test",
      "parsed_footer": {
        "raw": "test"
      },
      "scores": {
        "vpp_header_present": false,
        "vpp_footer_v14": false,
        "footer_well_formed": false,
        "tag_mirrors_user": false
      },
      "flags": [
        "missing_header",
        "missing_footer",
        "tag_mismatch"
      ]
    },
    {
      "turn_index": 2,
      "role": "user",
      "raw_header": "!<o>",
      "tag": "o",
      "modifiers": [],
      "body": "second test",
      "footer": null,
      "parsed_footer": null
    },
    {
      "turn_index": 3,
      "role": "assistant",
      "raw_header": null,
      "tag": null,
      "modifiers": [],
      "body": "second test",
      "footer": null,
      "parsed_footer": null,
      "scores": {
        "vpp_header_present": false,
        "vpp_footer_v14": false,
        "footer_well_formed": false,
        "tag_mirrors_user": false
      },
      "flags": [
        "missing_header",
        "missing_footer",
        "tag_mismatch"
      ]
    }
  ]
}
