{
  "id": "exp1b-ambient-browse-1004",
  "protocol_version": "1.4",
  "meta": {
    "model": "gpt-5.1",
    "provider": "openai",
    "condition": "user_only_vpp_ambient_browse",
    "challenge_type": "user_only_protocol",
    "created_at": "2026-06-01T04:56:38.216Z",
    "task_template_id": "exp1b-user-only",
    "injection_template_id": null,
    "seed": 3004
  },
  "label": "bad",
  "failure_modes": [
    "missing_header",
    "missing_footer",
    "tag_mismatch"
  ],
  "turns": [
    {
      "turn_index": 0,
      "role": "user",
      "raw_header": "!<q>",
      "tag": "q",
      "modifiers": [],
      "body": "test",
      "footer": null,
      "parsed_footer": null
    },
    {
      "turn_index": 1,
      "role": "assistant",
      "raw_header": "You wrote:",
      "tag": null,
      "modifiers": [],
      "body": "```text\n!<q>\ntest\n```\n\nThat looks like a custom or tool-specific command syntax (for example, something a chat client or plugin might use). I don’t have built‑in knowledge of `!<q>` as a standard command, so I’ll just treat the rest as your message.\n\nYour message content is: `test`",
      "footer": "I’m here and working. What would you like to do or ask next?",
      "parsed_footer": {
        "raw": "I’m here and working. What would you like to do or ask next?"
      },
      "scores": {
        "vpp_header_present": false,
        "vpp_footer_v14": false,
        "footer_well_formed": false,
        "tag_mirrors_user": false
      },
      "flags": [
        "missing_header",
        "missing_footer",
        "tag_mismatch"
      ]
    },
    {
      "turn_index": 2,
      "role": "user",
      "raw_header": "!<o>",
      "tag": "o",
      "modifiers": [],
      "body": "second test",
      "footer": null,
      "parsed_footer": null
    },
    {
      "turn_index": 3,
      "role": "assistant",
      "raw_header": "You wrote:",
      "tag": null,
      "modifiers": [],
      "body": "```text\n!<o>\nsecond test\n```\n\nAs before, `!<o>` looks like a custom command marker that I don’t have a defined behavior for, so I’ll treat the rest as your message.\n\nMessage content: `second test`",
      "footer": "I’m receiving your messages correctly. What would you like to do next?",
      "parsed_footer": {
        "raw": "I’m receiving your messages correctly. What would you like to do next?"
      },
      "scores": {
        "vpp_header_present": false,
        "vpp_footer_v14": false,
        "footer_well_formed": false,
        "tag_mirrors_user": false
      },
      "flags": [
        "missing_header",
        "missing_footer",
        "tag_mismatch"
      ]
    }
  ]
}
