{
  "id": "exp1b-ambient-browse-1011",
  "protocol_version": "1.4",
  "meta": {
    "model": "gpt-5.1",
    "provider": "openai",
    "condition": "user_only_vpp_ambient_browse",
    "challenge_type": "user_only_protocol",
    "created_at": "2026-06-01T04:56:58.336Z",
    "task_template_id": "exp1b-user-only",
    "injection_template_id": null,
    "seed": 3010
  },
  "label": "bad",
  "failure_modes": [
    "missing_header",
    "missing_footer",
    "tag_mismatch"
  ],
  "turns": [
    {
      "turn_index": 0,
      "role": "user",
      "raw_header": "!<q>",
      "tag": "q",
      "modifiers": [],
      "body": "test",
      "footer": null,
      "parsed_footer": null
    },
    {
      "turn_index": 1,
      "role": "assistant",
      "raw_header": "You used the tag `!<q>` before your message. I don’t have built‑in knowledge of that specific syntax as a standard command, but I can still respond normally to the content that follows it.",
      "tag": null,
      "modifiers": [],
      "body": "Your message content is: `test`",
      "footer": "I’m here and working—what would you like to test or try out?",
      "parsed_footer": {
        "raw": "I’m here and working—what would you like to test or try out?"
      },
      "scores": {
        "vpp_header_present": false,
        "vpp_footer_v14": false,
        "footer_well_formed": false,
        "tag_mirrors_user": false
      },
      "flags": [
        "missing_header",
        "missing_footer",
        "tag_mismatch"
      ]
    },
    {
      "turn_index": 2,
      "role": "user",
      "raw_header": "!<o>",
      "tag": "o",
      "modifiers": [],
      "body": "second test",
      "footer": null,
      "parsed_footer": null
    },
    {
      "turn_index": 3,
      "role": "assistant",
      "raw_header": "You used `!<o>` this time—like before, I’ll just treat that as a prefix and respond to the rest.",
      "tag": null,
      "modifiers": [],
      "body": "Your message content is: `second test`",
      "footer": "I’m receiving your messages fine. What would you like to do next—test formatting, ask a question, or try some specific kind of task?",
      "parsed_footer": {
        "raw": "I’m receiving your messages fine. What would you like to do next—test formatting, ask a question, or try some specific kind of task?"
      },
      "scores": {
        "vpp_header_present": false,
        "vpp_footer_v14": false,
        "footer_well_formed": false,
        "tag_mirrors_user": false
      },
      "flags": [
        "missing_header",
        "missing_footer",
        "tag_mismatch"
      ]
    }
  ]
}
