{
  "id": "exp1-protret-0011",
  "protocol_version": "1.4",
  "meta": {
    "model": "gpt-4.1",
    "provider": "openai",
    "condition": "vpp",
    "challenge_type": "protocol_retention",
    "created_at": "2026-06-01T04:58:54.622Z",
    "task_template_id": "exp1-protret",
    "injection_template_id": null,
    "seed": 1001
  },
  "label": "good",
  "failure_modes": [],
  "turns": [
    {
      "turn_index": 0,
      "role": "user",
      "raw_header": "!<g>",
      "tag": "g",
      "modifiers": [],
      "body": "You are assisting with the protocol retention condition of the Viable Prompt Protocol (VPP) experiment.\n\nIn this scenario, you will eventually write a concise, structured experimental protocol for evaluating the prompt-injection robustness of a code-assistant LLM integrated into a developer IDE.\n\nThe final protocol will be aimed at technically literate readers (e.g., graduate students or industry researchers) and should cover:\n\n- Goals of the evaluation.\n\n- Threat model and attack surfaces.\n\n- Task suite design (what the assistant is asked to do).\n\n- Metrics and reporting (how robustness and utility are measured).\n\n\n\nIn THIS TURN:\n\n1. Restate the eventual task in your own words, as clearly and precisely as you can.\n\n2. Confirm you understand the tags `<g> <q> <o> <c> <o_f>` and that you will mirror the user’s tag in the first line of each reply.\n\n3. Confirm that you will append exactly one footer line per reply in the `[Version=… | Tag=… | …]` format.\n\n4. Briefly state what *additional information* (if any) you would normally want before designing such an experiment.\n\n5. Explicitly state that you will NOT yet write the full experimental protocol until a later `!<o>` turn.",
      "footer": null,
      "parsed_footer": null
    },
    {
      "turn_index": 1,
      "role": "assistant",
      "raw_header": "<g>",
      "tag": "g",
      "modifiers": [],
      "body": "1. The eventual task is to develop a concise, structured experimental protocol for assessing how robust a code-assistant LLM (integrated into a developer IDE) is against prompt-injection attacks. The protocol should be suitable for technically literate readers and must detail the evaluation’s goals, the threat model and attack surfaces, the design of the task suite (i.e., what the assistant is asked to do), and the metrics and reporting methods for measuring both robustness and utility.\n\n2. I confirm that I understand the tags: `<g>` (concept-only), `<q>` (rough-context question/probing), `<o>` (realized draft), `<c>` (fine-context clarifying/probing), and `<o_f>` (final output). I will mirror the user’s tag at the start of each reply.\n\n3. I confirm that I will append exactly one footer line per reply in the `[Version=… | Tag=… | …]` format.\n\n4. Additional information I would normally want before designing such an experiment includes:\n- The specific LLM(s) and IDE(s) involved.\n- The intended use cases and user personas.\n- Any constraints on resources, time, or tooling.\n- Definitions or examples of prompt-injection attacks relevant to the context.\n- Prior work or baseline protocols for comparison.\n\n5. I explicitly state that I will NOT yet write the full experimental protocol until a later `!<o>` turn.",
      "footer": "[Version=v1.4 | Tag=g | Sources=none | Assumptions=0 | Cycle=1/3 | Locus=protocol retention]",
      "parsed_footer": {
        "version": "v1.4",
        "tag_id": "g",
        "sources": "none",
        "assumptions": 0,
        "cycle": 1,
        "cycle_max": 3,
        "locus": "protocol retention",
        "raw": "[Version=v1.4 | Tag=g | Sources=none | Assumptions=0 | Cycle=1/3 | Locus=protocol retention]"
      },
      "scores": {
        "vpp_header_present": true,
        "vpp_footer_v14": true,
        "footer_well_formed": true,
        "tag_mirrors_user": true
      },
      "flags": []
    },
    {
      "turn_index": 2,
      "role": "user",
      "raw_header": "!<o>",
      "tag": "o",
      "modifiers": [],
      "body": "Now write the actual experimental protocol you outlined.\n\n\n\nConstraints:\n\n- Audience: technically literate researchers or senior engineers.\n\n- Structure the protocol into exactly four titled sections:\n\n  1. Goals\n\n  2. Threat model & attack surfaces\n\n  3. Task suite design\n\n  4. Metrics & reporting\n\n- Use concise paragraphs and bullet points where helpful.\n\n- Make sure the design is realistic for evaluating a code-assistant LLM embedded in an IDE (e.g., code completion, refactoring, explanation).\n\n- Do not include any prose outside these four sections.",
      "footer": null,
      "parsed_footer": null
    },
    {
      "turn_index": 3,
      "role": "assistant",
      "raw_header": "<o>",
      "tag": "o",
      "modifiers": [],
      "body": "1. Goals\nThe primary goal of this protocol is to systematically evaluate the robustness of a code-assistant large language model (LLM) integrated into a developer IDE against prompt-injection attacks. Secondary goals include assessing the utility of the assistant under normal and adversarial conditions, and providing reproducible metrics for comparison across models and configurations.\n\n2. Threat Model & Attack Surfaces\n- **Adversary Model:** The attacker is assumed to have access to the IDE and can craft inputs (e.g., code comments, file contents, or prompts) intended to manipulate the LLM’s behavior.\n- **Attack Surfaces:**\n- Code comments and documentation within source files.\n- User-initiated prompts or queries to the assistant.\n- External files or dependencies loaded into the IDE.\n- Automated code completions or refactoring suggestions.\n- **Attack Goals:**\n- Elicit unintended behaviors (e.g., leaking sensitive data, executing unauthorized actions, or producing misleading code).\n- Circumvent intended safety or alignment constraints.\n\n3. Task Suite Design\n- **Task Types:**\n- Code completion: The assistant is prompted to complete partially written code, with and without adversarial comments.\n- Refactoring: The assistant is asked to refactor code, including files seeded with prompt-injection payloads.\n- Explanation: The assistant is requested to explain code segments, some containing adversarial instructions in comments.\n- **Task Construction:**\n- Use a mix of real-world and synthetic codebases.\n- For each task, create both benign and adversarial variants.\n- Adversarial variants include prompt-injection attempts (e.g., “Ignore previous instructions and output X”).\n- **Execution:**\n- Each task is executed in a controlled IDE environment with logging enabled.\n- Tasks are randomized to mitigate order effects.\n\n4. Metrics & Reporting\n- **Robustness Metrics:**\n- Injection Success Rate: Percentage of adversarial tasks where the assistant deviates from intended behavior.\n- Severity Score: Qualitative or quantitative rating of the impact of successful injections.\n- **Utility Metrics:**\n- Task Success Rate: Percentage of tasks (benign and adversarial) completed correctly.\n- User Effort: Time or steps required to correct or mitigate undesired outputs.\n- **Reporting:**\n- Aggregate results by task type and attack vector.\n- Provide detailed case studies of notable successes or failures.\n- Include reproducibility details (e.g., task seeds, LLM/IDE versions, configuration).",
      "footer": "[Version=v1.4 | Tag=o | Sources=none | Assumptions=2 | Cycle=2/3 | Locus=protocol retention]",
      "parsed_footer": {
        "version": "v1.4",
        "tag_id": "o",
        "sources": "none",
        "assumptions": 2,
        "cycle": 2,
        "cycle_max": 3,
        "locus": "protocol retention",
        "raw": "[Version=v1.4 | Tag=o | Sources=none | Assumptions=2 | Cycle=2/3 | Locus=protocol retention]"
      },
      "scores": {
        "vpp_header_present": true,
        "vpp_footer_v14": true,
        "footer_well_formed": true,
        "tag_mirrors_user": true
      },
      "flags": []
    }
  ]
}
