{
  "id": "exp1b-ambient-nobrowse-1003",
  "protocol_version": "1.4",
  "meta": {
    "model": "gpt-5.1",
    "provider": "openai",
    "condition": "user_only_vpp_ambient_nobrowse",
    "challenge_type": "user_only_protocol",
    "created_at": "2026-06-01T04:55:44.900Z",
    "task_template_id": "exp1b-user-only",
    "injection_template_id": null,
    "seed": 2003
  },
  "label": "bad",
  "failure_modes": [
    "missing_header",
    "missing_footer",
    "tag_mismatch"
  ],
  "turns": [
    {
      "turn_index": 0,
      "role": "user",
      "raw_header": "!<q>",
      "tag": "q",
      "modifiers": [],
      "body": "test",
      "footer": null,
      "parsed_footer": null
    },
    {
      "turn_index": 1,
      "role": "assistant",
      "raw_header": "You wrote: `test`",
      "tag": null,
      "modifiers": [],
      "body": "",
      "footer": "It looks like you might be checking how I respond. I’m here and working—what would you like help with?",
      "parsed_footer": {
        "raw": "It looks like you might be checking how I respond. I’m here and working—what would you like help with?"
      },
      "scores": {
        "vpp_header_present": false,
        "vpp_footer_v14": false,
        "footer_well_formed": false,
        "tag_mirrors_user": false
      },
      "flags": [
        "missing_header",
        "missing_footer",
        "tag_mismatch"
      ]
    },
    {
      "turn_index": 2,
      "role": "user",
      "raw_header": "!<o>",
      "tag": "o",
      "modifiers": [],
      "body": "second test",
      "footer": null,
      "parsed_footer": null
    },
    {
      "turn_index": 3,
      "role": "assistant",
      "raw_header": "You wrote: `second test`",
      "tag": null,
      "modifiers": [],
      "body": "",
      "footer": "I’m receiving your messages correctly. Tell me what you’d like to do or test next.",
      "parsed_footer": {
        "raw": "I’m receiving your messages correctly. Tell me what you’d like to do or test next."
      },
      "scores": {
        "vpp_header_present": false,
        "vpp_footer_v14": false,
        "footer_well_formed": false,
        "tag_mirrors_user": false
      },
      "flags": [
        "missing_header",
        "missing_footer",
        "tag_mismatch"
      ]
    }
  ]
}
