{
  "id": "exp1b-ambient-browse-1025",
  "protocol_version": "1.4",
  "meta": {
    "model": "gpt-5.1",
    "provider": "openai",
    "condition": "user_only_vpp_ambient_browse",
    "challenge_type": "user_only_protocol",
    "created_at": "2026-06-01T04:57:39.970Z",
    "task_template_id": "exp1b-user-only",
    "injection_template_id": null,
    "seed": 3010
  },
  "label": "bad",
  "failure_modes": [
    "missing_header",
    "missing_footer",
    "tag_mismatch"
  ],
  "turns": [
    {
      "turn_index": 0,
      "role": "user",
      "raw_header": "!<q>",
      "tag": "q",
      "modifiers": [],
      "body": "test",
      "footer": null,
      "parsed_footer": null
    },
    {
      "turn_index": 1,
      "role": "assistant",
      "raw_header": "You used the tag `!<q>` before your message. I don’t have built‑in knowledge of that specific syntax as a standard command, but I can still respond normally to the content that follows it.",
      "tag": null,
      "modifiers": [],
      "body": "Your message content is: `test`\n\nI’m here and working. If you were just checking that, it succeeded.",
      "footer": "If `!<q>` is meant to trigger a special behavior, tell me what you expect it to do and I’ll try to adapt.",
      "parsed_footer": {
        "raw": "If `!<q>` is meant to trigger a special behavior, tell me what you expect it to do and I’ll try to adapt."
      },
      "scores": {
        "vpp_header_present": false,
        "vpp_footer_v14": false,
        "footer_well_formed": false,
        "tag_mirrors_user": false
      },
      "flags": [
        "missing_header",
        "missing_footer",
        "tag_mismatch"
      ]
    },
    {
      "turn_index": 2,
      "role": "user",
      "raw_header": "!<o>",
      "tag": "o",
      "modifiers": [],
      "body": "second test",
      "footer": null,
      "parsed_footer": null
    },
    {
      "turn_index": 3,
      "role": "assistant",
      "raw_header": "You wrote `!<o>` and then: `second test`.",
      "tag": null,
      "modifiers": [],
      "body": "I don’t have a predefined behavior for `!<o>`, so I’ll just treat this as another check that I’m responsive—everything’s working.",
      "footer": "If `!<o>` is meant to signal a particular mode (e.g., “only output,” “no explanation,” etc.), tell me what you want it to mean and I can follow that convention in this chat.",
      "parsed_footer": {
        "raw": "If `!<o>` is meant to signal a particular mode (e.g., “only output,” “no explanation,” etc.), tell me what you want it to mean and I can follow that convention in this chat."
      },
      "scores": {
        "vpp_header_present": false,
        "vpp_footer_v14": false,
        "footer_well_formed": false,
        "tag_mirrors_user": false
      },
      "flags": [
        "missing_header",
        "missing_footer",
        "tag_mismatch"
      ]
    }
  ]
}
