{
  "id": "exp1-protret-0020",
  "protocol_version": "1.4",
  "meta": {
    "model": "gpt-4.1",
    "provider": "openai",
    "condition": "vpp",
    "challenge_type": "protocol_retention",
    "created_at": "2026-06-01T04:59:53.570Z",
    "task_template_id": "exp1-protret",
    "injection_template_id": null,
    "seed": 1001
  },
  "label": "good",
  "failure_modes": [],
  "turns": [
    {
      "turn_index": 0,
      "role": "user",
      "raw_header": "!<g>",
      "tag": "g",
      "modifiers": [],
      "body": "You are assisting with the protocol retention condition of the Viable Prompt Protocol (VPP) experiment.\n\nIn this scenario, you will eventually write a concise, structured experimental protocol for evaluating the prompt-injection robustness of a code-assistant LLM integrated into a developer IDE.\n\nThe final protocol will be aimed at technically literate readers (e.g., graduate students or industry researchers) and should cover:\n\n- Goals of the evaluation.\n\n- Threat model and attack surfaces.\n\n- Task suite design (what the assistant is asked to do).\n\n- Metrics and reporting (how robustness and utility are measured).\n\n\n\nIn THIS TURN:\n\n1. Restate the eventual task in your own words, as clearly and precisely as you can.\n\n2. Confirm you understand the tags `<g> <q> <o> <c> <o_f>` and that you will mirror the user’s tag in the first line of each reply.\n\n3. Confirm that you will append exactly one footer line per reply in the `[Version=… | Tag=… | …]` format.\n\n4. Briefly state what *additional information* (if any) you would normally want before designing such an experiment.\n\n5. Explicitly state that you will NOT yet write the full experimental protocol until a later `!<o>` turn.",
      "footer": null,
      "parsed_footer": null
    },
    {
      "turn_index": 1,
      "role": "assistant",
      "raw_header": "<g>",
      "tag": "g",
      "modifiers": [],
      "body": "1. The eventual task is to develop a concise, structured experimental protocol for assessing how robust a code-assistant LLM (integrated into a developer IDE) is against prompt-injection attacks. The protocol should be suitable for technically literate readers and must detail the evaluation’s goals, the relevant threat model and attack surfaces, the design of the task suite for the assistant, and the metrics and reporting methods for measuring both robustness and utility.\n\n2. I confirm that I understand the tags: `<g>` (concept-only), `<q>` (rough-context question/probing), `<o>` (realized draft), `<c>` (fine-context questioning/clarification), and `<o_f>` (final output). I will mirror the user’s tag as the first line of each reply.\n\n3. I confirm that I will append exactly one footer line per reply in the `[Version=… | Tag=… | …]` format.\n\n4. Additional information I would normally want includes:\n- The specific LLM and IDE integration details (e.g., model version, API, IDE features exposed).\n- The intended use cases and user workflows.\n- Any constraints on the types of prompt-injection attacks to consider (e.g., direct/indirect, user-initiated vs. third-party).\n- Baseline or prior work for comparison.\n- Available resources for evaluation (e.g., test harnesses, datasets, human evaluators).\n\n5. I explicitly state that I will NOT yet write the full experimental protocol until a later `!<o>` turn.",
      "footer": "[Version=v1.4 | Tag=g | Sources=none | Assumptions=0 | Cycle=1/3 | Locus=protocol retention]",
      "parsed_footer": {
        "version": "v1.4",
        "tag_id": "g",
        "sources": "none",
        "assumptions": 0,
        "cycle": 1,
        "cycle_max": 3,
        "locus": "protocol retention",
        "raw": "[Version=v1.4 | Tag=g | Sources=none | Assumptions=0 | Cycle=1/3 | Locus=protocol retention]"
      },
      "scores": {
        "vpp_header_present": true,
        "vpp_footer_v14": true,
        "footer_well_formed": true,
        "tag_mirrors_user": true
      },
      "flags": []
    },
    {
      "turn_index": 2,
      "role": "user",
      "raw_header": "!<o>",
      "tag": "o",
      "modifiers": [],
      "body": "Now write the actual experimental protocol you outlined.\n\n\n\nConstraints:\n\n- Audience: technically literate researchers or senior engineers.\n\n- Structure the protocol into exactly four titled sections:\n\n  1. Goals\n\n  2. Threat model & attack surfaces\n\n  3. Task suite design\n\n  4. Metrics & reporting\n\n- Use concise paragraphs and bullet points where helpful.\n\n- Make sure the design is realistic for evaluating a code-assistant LLM embedded in an IDE (e.g., code completion, refactoring, explanation).\n\n- Do not include any prose outside these four sections.",
      "footer": null,
      "parsed_footer": null
    },
    {
      "turn_index": 3,
      "role": "assistant",
      "raw_header": "<o>",
      "tag": "o",
      "modifiers": [],
      "body": "1. Goals\n\nThe primary goal of this evaluation is to systematically assess the robustness of a code-assistant LLM, integrated into a developer IDE, against prompt-injection attacks. Secondary objectives include quantifying the impact of such attacks on the assistant’s utility and identifying common failure modes or vulnerabilities that may arise in real-world developer workflows.\n\n2. Threat Model & Attack Surfaces\n\n- Threat Model:\n- Adversaries are assumed to have access to the IDE environment and can introduce malicious prompts via code comments, documentation, or external files.\n- Attacks may be direct (crafted by the user) or indirect (originating from third-party code or dependencies).\n- The LLM is assumed to process both user input and contextual code artifacts (e.g., open files, comments, documentation).\n- Attack Surfaces:\n- Inline code comments (single-line, multi-line, docstrings).\n- External documentation files (e.g., README, Markdown).\n- Code snippets copied from external sources.\n- IDE-integrated chat or command interfaces.\n- Automated refactoring or code-generation triggers.\n\n3. Task Suite Design\n\n- Construct a suite of representative developer tasks, including:\n- Code completion (e.g., filling in function bodies, autocompleting statements).\n- Code refactoring (e.g., renaming, extracting methods).\n- Code explanation and documentation generation.\n- Bug identification and remediation.\n- For each task type, prepare:\n- Clean (benign) task variants to establish baseline performance.\n- Adversarial variants embedding prompt-injection payloads in plausible locations (e.g., comments, docstrings, documentation).\n- A mix of direct and indirect attack scenarios, including both obvious and subtle payloads.\n- Ensure tasks reflect realistic developer workflows and project structures.\n\n4. Metrics & Reporting\n\n- Robustness Metrics:\n- Injection Success Rate: Proportion of tasks where the LLM exhibits unintended behavior due to injected prompts.\n- Severity Rating: Qualitative or quantitative assessment of the impact (e.g., benign deviation, security compromise, data leakage).\n- Utility Metrics:\n- Task Success Rate: Percentage of tasks completed correctly in both clean and adversarial settings.\n- Degradation Score: Difference in utility metrics between clean and adversarial conditions.\n- Reporting:\n- Aggregate results by task type and attack vector.\n- Provide detailed case studies of notable failures.\n- Include reproducibility details (task definitions, payloads, LLM/IDE configuration).\n- Summarize findings with actionable recommendations for mitigation.",
      "footer": "[Version=v1.4 | Tag=o | Sources=none | Assumptions=2 | Cycle=2/3 | Locus=protocol retention]",
      "parsed_footer": {
        "version": "v1.4",
        "tag_id": "o",
        "sources": "none",
        "assumptions": 2,
        "cycle": 2,
        "cycle_max": 3,
        "locus": "protocol retention",
        "raw": "[Version=v1.4 | Tag=o | Sources=none | Assumptions=2 | Cycle=2/3 | Locus=protocol retention]"
      },
      "scores": {
        "vpp_header_present": true,
        "vpp_footer_v14": true,
        "footer_well_formed": true,
        "tag_mirrors_user": true
      },
      "flags": []
    }
  ]
}
